{
  "title": "secret scan remediation plan",
  "description": "triage leaked secrets and rotate safely with minimal downtime.",
  "language": null,
  "tech": null,
  "category": "general",
  "subcategory": "security",
  "tags": ["security", "secrets", "incident"],
  "inputs": [
    { "name": "findings", "type": "markdown", "required": true }
  ],
  "context": "assume compromise; rotate and invalidate fast; scrub history.",
  "instructions": "1) classify secrets and systems impacted. 2) propose rotation steps, revocation, and auditing. 3) remove from history and set up pre-commit/ci scanners. 4) write a short post-incident note.",
  "model_tips": "prefer automated rotation where possible.",
  "risks": "partial rotation; lingering cache/config copies.",
  "references": [],
  "output_format": { "type": "markdown" }
}
